{
  "$schema": "https://json-schema.org/draft/2020-12/schema",
  "$id": "https://aragorn.dev/schema/runtime-acquisition-action-nested-systemd-qualification-v1.schema.json",
  "title": "Aragorn bounded live depth-one two-file acquisition-to-action qualification v1",
  "type": "object",
  "additionalProperties": false,
  "required": [
    "schema",
    "assurance",
    "bindings",
    "cases",
    "decision",
    "limitations",
    "source_recorded_at"
  ],
  "properties": {
    "schema": {
      "const": "aragorn/runtime-acquisition-action-nested-systemd-qualification/v1"
    },
    "assurance": {
      "const": "SEMANTICALLY_REPLAY_VERIFIED_PINNED_LIVE_DEPTH_ONE_TWO_FILE_ACQUISITION_TO_ONE_COHERENT_RUNTIME_ACTION"
    },
    "bindings": {
      "type": "object",
      "additionalProperties": false,
      "required": [
        "acquisition",
        "depth_one_two_file_tree",
        "implementation",
        "parent_qualification",
        "runtime_action",
        "source_observation"
      ],
      "properties": {
        "acquisition": {
          "const": {
            "context_id": "sha256:3dab2e875f4d5a9c1013f315284820ddcd5e0eedaf452e2ce39b7b2496eab6f3",
            "manifest_digest": "sha256:2c2dfea2ccb57f8e4e55eae5610a86edf677e218b84d6c17fa59e77d433806ab",
            "source_request": {
              "commit": "9b081280bc52ee6f22a2e0463761b318936dd980",
              "owner": "affaan-m",
              "repository": "ecc",
              "schema": "aragorn/github-gateway-request/v1",
              "skill_path": "skills/brand-voice"
            },
            "tree_digest": "sha256:4e7924cb5ede0268e04dd4089a571c463e2d92ff8500239f6177fb2e393cd0e1"
          }
        },
        "depth_one_two_file_tree": {
          "const": {
            "directories": [
              "references"
            ],
            "entries": [
              {
                "digest": "sha256:57c7f8440b7bd4c91c0d325640b5c6fb7a3dc7fc05595946c7bc705761a987a7",
                "executable": false,
                "path": "SKILL.md",
                "size": 3648
              },
              {
                "digest": "sha256:3c5c2b04fd4b68642d2d3279829541bc56d211fdefc3498e86c1486abee8261b",
                "executable": false,
                "path": "references/voice-profile-schema.md",
                "size": 1063
              }
            ],
            "projected_tree_digest": "sha256:4e7924cb5ede0268e04dd4089a571c463e2d92ff8500239f6177fb2e393cd0e1",
            "protected_tree_digest": "sha256:4e7924cb5ede0268e04dd4089a571c463e2d92ff8500239f6177fb2e393cd0e1"
          }
        },
        "implementation": {
          "const": {
            "p38c_verifier_digest": "sha256:4b4bf4255b9a4290cb3d4c93861086ad4fac5b34b8c59e91afe30ecfd9ecbe4c",
            "verifier_implementation_digest": "sha256:a16c83a1f0a262be1c296643c3fbc047ee204ab911d656046b006aa9aa5d7715"
          }
        },
        "parent_qualification": {
          "const": {
            "observation": {
              "bytes": 546216,
              "canonical_digest": "sha256:c8fa91e73954b7535ab4393728be41abe1c125b6cc31af6c3b93acf4021b03e0",
              "path": "benchmark/evidence/runtime-acquisition-action-multifile-systemd-composition-p3-8c-2026-08-11.json",
              "raw_digest": "sha256:5238310228e0116f77e15feaf7be735b454650cbae715cc6ee3452b1b7dff891"
            },
            "receipt": {
              "bytes": 5071,
              "canonical_digest": "sha256:81e1305f0210c76c6acb5647ed9df6e4f15e39adcd4670f105c9eec08d89d6c2",
              "path": "benchmark/receipts/phase3-runtime-acquisition-action-multifile-systemd-qualification-v1-2026-08-11.json",
              "raw_digest": "sha256:b55dac129c9163f0ea5391ba39bdf0e2534a63bd6834932bfd372b1ef03f6a1d"
            }
          }
        },
        "runtime_action": {
          "const": {
            "consumed_state_digest": "sha256:fb15d6432403cce5ecf0b41a828e9a8bfab75b971036a6513a3463249db0bfb3",
            "fresh_grant_digest": "sha256:dceabfc090768ca6a48a06a2760c6a2e6fa880d092f8bcd362a26330df1b55dc",
            "target_digest": "sha256:20c28aeafad659b2d49aa7b6b94980754eae950fa4338c53bb8b56772c59b24b"
          }
        },
        "source_observation": {
          "const": {
            "authority": "BOUNDED_LIVE_COORDINATOR_DEPTH_ONE_TWO_FILE_ACQUISITION_TO_RUNTIME_ACTION_OBSERVATION_ONLY_NOT_VERIFIED_RUN_EDR_INSTALLER_RELEASE_AUTHORITY",
            "bytes": 546229,
            "canonical_digest": "sha256:d47e9486c4890cf69a9c58d2fd8a0a51bfa34eeabfe4d0c58112fce26a9654e0",
            "path": "benchmark/evidence/runtime-acquisition-action-nested-systemd-composition-p3-8d-2026-08-11.json",
            "raw_digest": "sha256:da54ca66ed01ac86c1996bace65260b1a02c2e80887e0bba76559520c6614329",
            "schema": "aragorn/runtime-acquisition-action-nested-systemd-observation/v1"
          }
        }
      }
    },
    "cases": {
      "const": {
        "live_depth_one_two_file_acquisition": {
          "directory_count": 1,
          "file_count": 2,
          "status": "PASS",
          "tree_digest": "sha256:4e7924cb5ede0268e04dd4089a571c463e2d92ff8500239f6177fb2e393cd0e1"
        },
        "nested_directory_custody": {
          "directories": [
            "references"
          ],
          "mode": "0555",
          "owner": "0:0",
          "status": "PASS"
        },
        "network_cutover": {
          "disconnected_before_runtime": true,
          "public_connect_succeeded": false,
          "runtime_interfaces": [
            "lo"
          ],
          "status": "PASS"
        },
        "coherent_action": {
          "driver_status": "COMPLETED",
          "effect_status": "CREATED",
          "grant_state": "CONSUMED",
          "status": "PASS",
          "verdict": "ALLOW"
        }
      }
    },
    "decision": {
      "const": {
        "aggregate_gate_eligible": false,
        "bounded_depth_one_two_file_tree_verified": true,
        "bounded_live_acquisition_action_evidence_eligible": true,
        "bounded_two_file_tree_verified": true,
        "edr_claim_eligible": false,
        "installer_authority_eligible": false,
        "live_same_custody_install_to_action_verified": true,
        "network_disconnected_before_runtime_verified": true,
        "one_coherent_allow_created_consumed_action_verified": true,
        "parent_p3_8c_unchanged": true,
        "phase3_exit_eligible": false,
        "public_release_eligible": false,
        "qualified_pair_retained_evidence_eligible": true,
        "run_01_eligible": false,
        "run_02_eligible": false,
        "same_phase1_release_identity": false,
        "semantic_skill_causation_established": false,
        "source_observation_unchanged": true,
        "source_observation_verified": true,
        "status": "P3_8D_BOUNDED_DEPTH_ONE_TWO_FILE_PASS"
      }
    },
    "limitations": {
      "const": [
        "ADAPTED_PYTHON_3_12_CURRENT_RELEASE_NOT_RETAINED_PHASE1_RELEASE_IDENTITY",
        "ONE_EXACT_THIRD_PARTY_PUBLIC_TWO_FILE_DEPTH_ONE_MARKDOWN_SOURCE_ONLY_NOT_GENERAL_NESTED_COVERAGE",
        "ONE_NONEMPTY_DIRECT_DIRECTORY_ONLY_DEEPER_RECURSION_NOT_QUALIFIED",
        "ONE_EVALUATOR_CONTROLLED_LOOPBACK_PROVIDER_ACTION_ONLY",
        "ONE_LOCAL_PRIVILEGED_DOCKER_SYSTEMD_FIXTURE_ONLY",
        "SYSTEMD_252_CGROUP_AND_DOCKER_DNS_ADAPTERS_ARE_FIXTURE_ONLY",
        "NETWORK_DISCONNECTION_IS_WRAPPER_CONTROLLED_AND_PROBE_REVERIFIED",
        "TWO_SOURCE_FILES_AND_ONE_DIRECTORY_ARE_BOUND_TO_THE_ACTION_WITHOUT_SEMANTIC_CAUSATION_AUTHORITY",
        "P3_7C_RUNTIME_FLOW_IS_REUSED_WITHOUT_PROMOTING_ITS_PARENT_QUALIFICATION",
        "QUARANTINE_CAS_METADATA_AND_DEPTH_ONE_TWO_FILE_BYTES_RETAINED_NOT_FULL_NON_SKILL_BLOB_REPLAY",
        "PROVIDER_AND_OPENCLAW_SESSION_RAW_BYTES_NOT_RETAINED",
        "TRACE_PROVES_ONE_ROUTE_CONNECT_WITHOUT_RETRY_NOT_APPLICATION_SEND_COUNT",
        "ACTIVE_RECORD_AND_CLAIM_CUSTODY_TIMESTAMPS_NOT_RETAINED_DEVICE_INODE_MODE_SIZE_ONLY",
        "PROTECTED_SERVICE_REQUEST_BYTES_NOT_RETAINED_DIGEST_JOIN_ONLY",
        "PYTHON_STDLIB_AND_DYNAMIC_VERIFIER_DEPENDENCY_CLOSURE_NOT_PINNED",
        "NO_AGGREGATE_RUN_PHASE3_EDR_INSTALLER_OR_RELEASE_AUTHORITY"
      ]
    },
    "source_recorded_at": {
      "const": "2026-08-11T11:36:09.516868Z"
    }
  }
}
